assignment_2/outputs/summary_stats_america_europe.csv

region,period,count,mean,median,std,min,q25,q75,q05,q95,max
America,1900-1950,904,5.699630249740788,5.7039610389610385,0.5327085883835257,3.57,5.37575,6.004,4.94,6.551699999999999,7.92
America,1951-2000,893,5.7574413680135965,5.743333333333333,0.5267759796511362,3.1,5.44,6.07,4.976000000000001,6.705333333333333,7.94
Europe,1900-1950,831,5.501182421805222,5.52,0.6352111554478472,1.74,5.0550000000000015,5.885833333333334,4.6425,6.535,7.5
Europe,1951-2000,798,5.513135730199675,5.52,0.6086600727638984,2.58,5.0925,5.88,4.63,6.46,8.42

README.md

### Mean happiness score for each dataset

Next, the mean happiness score was calculated for each period. The mean score for the period of 1900–1950 was 5.6996, while the mean for the period of 1951–2000 was 5.7574.

### Distribution of happiness scores

For the period of 1900–1950, the median happiness score was 5.704, with most scores falling between approximately 5.38 and 6.00(25th–75th percentile range). Scores ranged from 3.57 to 7.92.

For the period from 1951–2000, the median happiness score was 5.743, with most scores falling between approximately 5.44 and 6.07. Scores ranged from 3.10 to 7.94.

### Summary statistics by region and period

In America, the average happiness score grew from 5.6996 in 1900-1950 to 5.7574 in 1951-2000.  
The mean happiness score in Europe grew from 5.5018 to 5.5131 for the same time period.